Title,Description,City
ParisBucket List: 40 EpicThings to Do in Paris– Earth Trekkers,"May 31, 2018· Stroll along the Champs-Élysées, dine at an outdoor café, enjoy the views from the Eiffel Tower and Arc de Triomphe, say hi to the Mona Lisa in the Louvre, and day trip to …",Paris
Things to Do in Paris,"Things to Do in Paris, France: See Tripadvisor's 5,079,851 traveler reviews and photos of Paris tourist attractions. Find what to do today, this weekend, or in April. We have reviews of the …",Paris
Top 10 Paris Attractions-ParisTravel Guide,"Planning your first visit to Paris? If so, start with these top 10 attractions and legendary sightseeing destinations. These are the historical, cultural, and famous places everyone …",Paris
54 can’t-missthings to do in Parisin 2025 - Time Out,54 can’t-miss things to do in Paris in 2025. Where do you start in this marvellous metropolis? We’ll help. Here’s our ultimate Paris bucket list,Paris
50 UniqueThings to Do in Paris,"If you’re planning a trip to Paris or even just dreaming about a trip, then this list of the 50 unique things to do in Paris is going to provide you with some great inspiration. In this comprehensive …",Paris
The 42 BESTThings to Do in Parisin 2025 – The Tour Guy,"Mar 5, 2025· In this time, you can visit must-see attractions, including the Louvre, the Eiffel Tower, and Notre Dame, while also making room for leisurely activities like wandering the …",Paris
31 BestThings To Do In Paris(Plus Map!),"Mar 17, 2023· Paris is a tourist paradise. The best things to do in Paris will always include taking a peek at the iconic Eiffel Tower, ascending the Arc de Triomphe, and watching an opera at …",Paris
"ParisBucket List: 62 BestThings to do in Paris, France","Mar 19, 2024· Looking for the best things to do in Paris? Here is the complete Paris bucket list that has everything you shouldn’t miss for an amazing trip to the French capital. Paris is an …",Paris
Top 20Things to Do in Paris: The Ultimate Guide 2025,"Mar 5, 2025· Here are 20 things to do in Paris that will enrich life in your spare time. Table of Contents. Why Choose Paris? 20 Best Things to Do in Paris 1. Go to the top of the Eiffel …",Paris
Things to Do in Paris,"Feb 7, 2025· Things to Do in Opéra / Bourse Things to Do in 8th Arr. - Élysée Things to Do in 1st Arr. - Louvre Things to Do in 13e Arr. – Gobelins Things to Do in 6th Arr. - Luxembourg Things …",Paris
The bestthings to do in London| Whatto do in London2025,"Dec 23, 2024· From royal palaces and museums to historic bridges and cathedrals, discover world-famous London attractions and iconic landmarks with the best things to see in London. Ready, steady… go! Tick all of London’s top 10 attractions off your to-do list. See 55 of London’s greatest landmarks on a 30-minute ride on the London Eye.",London
THE 15 BESTThings to Do in London(2025) -Tripadvisor,"Things to Do in London, England: See Tripadvisor's 7,340,029 traveler reviews and photos of London tourist attractions. Find what to do today, this weekend, or in April. We have reviews of the best places to see in London. Visit top-rated & must-see attractions.",London
50 Of TheBest Things To Do In London- SecretLondon,"Mar 18, 2025· From whiling away the hours in Covent Garden to strolling through the picturesque Highgate Cemetery, London is packed full of activities to try at least once in your life. Here’s our rundown of the best of them.",London
LondonBucket List: 50 EpicThings to Do in London- Earth …,"Feb 17, 2017· London bucket list: best things to do in London, with a top ten list for first-timers, including day trip ideas and things to do with kids.",London
"34Best Things to Do in London, England | U.S. News Travel","Mar 19, 2025· From the British Museum to Buckingham Palace, London is home to some of the most famous landmarks. Find expert recommendations for the best things to do in London here.",London
Things to do in London| Days Out & Activitiesin London-visitlondon.com,"Explore the city on sightseeing tours, soak up culture at museums and galleries, or choose from the many free things to do. Treat yourself on famous shopping streets and celebrate special occasions at world-class theatre shows, London musicals, restaurants and bars.",London
The 50 bestthings to do in London- Time Out,"Mar 4, 2025· Discover the city with our list of the best things to do and see in London for visitors and locals. From free days out to top restaurants, this is your ultimate London checklist for...",London
10 unmissableLondonattractions to visit in 2025 -visitlondon.com,"Feb 28, 2025· From the modern London Eye to the historic Tower of London, the top 10 tourist attractions in London are a must-see on any London sightseeing trip. Even better, many London landmarks are free to visit.",London
50 BestAttractions in Londonfor 2025 | Days Out andThings To Do,"Jan 13, 2025· Discover the most unmissable attractions in London, including Buckingham Palace, Shakespeare's Globe, the London Eye and more.",London
17 of the bestthings to do in London-Lonely Planet,"Oct 18, 2024· Explore the best things to do in London, from iconic landmarks like Big Ben to vibrant markets, world-class museums and lively neighborhoods.",London
"The 20 bestthings to do in Munich, Germany- TheMunichGuide","Jan 5, 2020· Visit Bavaria's capital like a local. A list of the top tourist attractions and things to do in Munich, Germany. Insider tips to plan your itinerary.",Munich
25Best Things to Do in Munich(Germany) -The Crazy Tourist,"Jun 10, 2022· Bavaria’s capital is a cocktail of beloved sights, opulent Baroque churches and museums of the highest order. Munich’s Kunstareal is a cluster of art museums with so many …",Munich
Things to Do in Munich,"Things to Do in Munich, Germany: See Tripadvisor's 813,422 traveler reviews and photos of Munich tourist attractions. Find what to do today, this weekend, or in April. We have reviews of …",Munich
12 of the bestthings to do in Munich-Lonely Planet,"Mar 12, 2025· With its sprawling parks, sensational museums and (yes) lots of beer, Munich is hard to resist. Here are 12 of the top things you can do in the city.",Munich
"24 EssentialThings to Do in Munich, Germany ( + Day Trips)","Mar 22, 2024· Whether you're visiting for Oktoberfest or just planning to explore the city's famous sites like Marienplatz, these are the best things to do in Munich, Germany.",Munich
The 14 bestthings to do in Munich- Time Out,"Ready for a weekend in Munich? You're in the right place. Here's our local's guide to the city, from museums to beer.",Munich
"99 Fun and AwesomeThings to do in Munich, Germany","Apr 5, 2024· The ULTIMATE list of things to do in Munich, includes 99 awesome activities, food experiences, sights and more (both on and off the beaten path).",Munich
19 EPICThings to Do in Munich(2025): An Insider’s Guide - Miss …,"Nov 17, 2023· An epic list of all the best things to do in Munich to make the most out of your stay, from someone who's been there, done that!",Munich
Bestthings to do in Munich: Must-see attractions and tips,"Here are our top tips for experiencing Munich and getting to know the city. This overview includes all of our insider tips and highlights for a short trip, long weekend or a whole week in the city.",Munich
"20 fabulous things to do in Munich, Germany- Heather on her …","Jan 22, 2025· Bavarian beer halls and dirndls sit side by side with the towering Olympic tower and sleek BMW Welt as symbols of the city. The city is an ideal city break destination in …",Munich
THE 15 BESTThings to Do in Dhaka City(2025) -Tripadvisor,"Things to Do in Dhaka City, Bangladesh: See Tripadvisor's 64,049 traveler reviews and photos of Dhaka City tourist attractions. Find what to do today, this weekend, or in April. We have …",Dhaka
"10 BestThings To Do In Dhaka, Bangladesh - Trip101","Nov 4, 2024· Dhaka, the capital of Bangladesh, offers a host of attractions and activities for the discerning traveler. So pack your bags and check out what you can do here!",Dhaka
15 IncredibleThings to Do in Dhaka| Ultimate Travel Guide,"Mar 27, 2024· Your essential Dhaka travel guide. Find helpful tips, things to do, best places to visit, and local experiences in the heart of Bangladesh.",Dhaka
THE 30 BESTPlaces to Visit in Dhaka City(2025) -Tripadvisor,"Ahsan Manzil, Lalbag Fort, Flea & Street Markets, Archaeology Tours. For personalised recommendations, try our AI trip-planning product. See what other travellers like to do, based …",Dhaka
"10Things To Do In Dhaka, Bangladesh's Colourful Chaotic Capital.","Mar 17, 2025· Thinking of travel to Bangladesh? Here is our detailed guide for all the top things to do in Dhaka, how to get around and where to stay.",Dhaka
25 Best & FunThings to Do in Dhaka- The Tourist Checklist,"Dhaka is a destination that offers a rich blend of history, culture, and vibrant experiences. Whether exploring its historical sites, indulging in local cuisine, or enjoying the art scene, there is …",Dhaka
"9 Best Places to Visitin Dhaka, Bangladesh (2025)","Mar 3, 2025· You will find the best places to visit in Dhaka, Bangladesh in this guide, from the famous Pink Palace to lesser-known gems.",Dhaka
Top 50things to doand attractionsin DhakaCity - Wanderlog,"Mar 1, 2025· From the majestic Lalbagh Fort, a 17th-century marvel, to the contemporary design of the National Parliament House, the city is a treasure trove of attractions waiting to be …",Dhaka
Things To Do In Dhaka| Mad Traveller,"Oct 10, 2024· Here’s a list of must-visit attractions and activities that will make your stay in Dhaka an unforgettable experience. 1. Lalbagh Fort (Fort of Red) A historic monument dating back to …",Dhaka
Explore The Top 10Things To Do In Dhaka- tripjive.com,"Sep 29, 2024· Here are the top sights in Dhaka: Dhakeshwari Temple: This is the national temple of Bangladesh, important for Hindu worship. National Museum: It displays Bangladeshi history, …",Dhaka
"VeniceBucket List: 20 AmazingThings to Do in Venice, Italy","Jul 6, 2016· Strolling the canals, photographing Venice from its bridges and viewpoints, visiting St. Mark’s Basilica in the evening, and exploring its quieter neighborhoods are our favorite …",Venice
The 27 bestthings to do in Venicein 2025 - Time Out,"From free attractions to great food, here are the best things to do in Venice, Italy, both touristy and non-touristy.",Venice
"15 of the bestthings to do in Venice, Italy -Lonely Planet","Feb 16, 2025· Visitors flock to Venice year-round, and who can blame them? Some 118 islands float on this fairy-tale lagoon, linked by 400 bridges. Each is crammed with dazzling palazzi …",Venice
20Best Things to Do in Venice| U.S. News Travel,"Feb 13, 2025· Ranking of the top 20 things to do in Venice. Travelers favorites include #1 St. Mark's Basilica (Basilica di San Marco), #2 Grand Canal and more.",Venice
"Things to Do in Venice, Italy -VeniceAttractions -Tripadvisor","Book these experiences for a close-up look at Venice. These rankings are informed by Tripadvisor data—we consider traveler reviews, ratings, number of page views, and user location. 1. …",Venice
15Best Things to Do in Venice(Italy) - The Crazy Tourist,"Jun 1, 2022· Today, Venice remains an important economic centre and is one of the most popular cities for tourism in the world – Sights like St. Marks’s Basilica and the Grand Canal …",Venice
30 BestThings To Do In VeniceFor 2025 - Expert Vagabond,"Feb 25, 2025· Top experiences in Venice, Italy! Ride a gondola on the canals, explore beautiful palaces, and discover my list of best things to do.",Venice
50 BestThings to Do in Venice[with Tickets] - 2025,"Nov 4, 2024· Venice, the “Floating City,” is a marvel of engineering with 118 islands, 175 canals, and 400 bridges. A UNESCO World Heritage Site, Venice boasts a rich history as a powerful …",Venice
"18 BestThings to Do in Venice, Italy(+Map of Top Sights)","Feb 27, 2025· Visiting Venice in Italy and wondering what are the absolute best places to see and things to do in Venice? In this guide, we cover all the musts: the main landmarks, must …",Venice
THE 15 BESTThings to Do in Venice(2025) - Tripadvisor,"Oct 30, 2024· Things to Do in Venice, Italy: See Tripadvisor's 1,449,100 traveler reviews and photos of Venice tourist attractions. Find what to do today, this weekend, or in April. We have …",Venice
The 27 greatestthings to do in Romein 2025 - Time Out,Here are the best things to do in Rome. RECOMMENDED: 🏛️ Unmissable attractions in Rome 🍝 The best restaurants in Rome 🛍️ Where to go shopping in Rome 🏘️ The best Airbnbs in Rome,Rome
30Things to Do in Rome| The UltimateRomeBucket List,"Jan 7, 2023· Rome bucket list: best things to do in Rome. Top 10 must-have experiences & things to do with more time. Map, photos, Rome itineraries.",Rome
25Best Things to Do in Rome- U.S. News Travel,"Mar 19, 2025· Take time to enjoy la dolce vita – even a week isn't long enough to experience everything Rome has to offer. From historic tours through ancient Rome to admiring art-filled institutions to...",Rome
25 BestThings to Do in Rome(Italy) - The Crazy Tourist,"May 31, 2022· Rome is consistently ranked as one of the top tourist destinations in Europe and with sights such as the Colosseum and the Vatican, it is easy to see why. Lets explore the best things to do in Rome: 1. Colosseum.",Rome
10 of the bestthings to do in Romein 2024 -Lonely Planet,"Feb 13, 2025· Let these 10 classically Roman experiences set you off in the right direction. Trevi Fountain is a non-negotiable. Wirestock Creators/Shutterstock. 1. Lose yourself in Ancient Rome (but not all in one day) Any Italian will tell you how downright anarchic Rome is and immediately follow it up by saying, “but Rome is Rome.”",Rome
Things to Do in Rome,"Things to Do in Rome, Italy: See Tripadvisor's 5,662,015 traveler reviews and photos of Rome tourist attractions. Find what to do today, this weekend, or in April. We have reviews of the best places to see in Rome. Visit top-rated & must-see attractions.",Rome
11 UnmissableAttractions in Romefor Every Bucket List - Time Out,"From magnificent churches and ancient ruins to world-famous artworks, these attractions should be on every tourist’s bucket list. The seat of the Roman Empire and the Papacy, Rome is one of the...",Rome
29 BestThings to Do in RomeItaly (Updated 2025),"Dec 19, 2024· From iconic landmarks to charming neighbourhoods, this list of the 28 best things to do in Rome will guide you through the city’s unmissable sights and hidden gems. Whether you’re a first-time visitor or a seasoned traveler, Rome offers unforgettable experiences.",Rome
101 FantasticThings To Do In Rome- UltimateRomeGuide -Rome…,"Dec 12, 2024· Wondering what to do in Rome? Find here our extensive guide to the 101 best things to do in Rome and plan an unforgettable trip in the eternal city!",Rome
"The Ultimate Guide toThings to Do in Rome, Italy - jotzle.com","Ok, here are the top things to do in Rome: 1. Iconic Historical Landmarks. When you think of Rome, chances are you imagine its incredible ancient landmarks. The Eternal City is practically a living museum, and the history here is both awe-inspiring and fascinating. Let’s dive into some of Rome’s most iconic sites that will transport you back in time. The Colosseum",Rome
The 23 bestthings to do in Florencein 2025 - Time Out,"The 23 best things to do in Florence in 2025. Ready to really discover the Renaissance city? Da Vinci, gelato and the most spectacular views await you",Florence
FlorenceBucket List: 30 BestThings to Do in Florence,"Feb 18, 2023· Visit beautiful gardens with amazing views of Florence, tour the numerous cathedrals in the city center, and visit one or two rooftop bars in Florence. We do our best to keep the hours of operation and pricing up to date for each attraction, however, these can change at any time.",Florence
"17 Best Things to Do in Florence, Italy | U.S. News Travel","Jan 31, 2025· Discover the best things to do in Florence, Italy, from visiting world-renowned art galleries to admiring Renaissance architecture, including the iconic Duomo.",Florence
Things to Do in Florence,"Things to Do in Florence, Italy: See Tripadvisor's 2,086,521 traveler reviews and photos of Florence tourist attractions. Find what to do today, this weekend, or in April. We have reviews of the best places to see in Florence. Visit top-rated & must-see attractions.",Florence
Things to do in FlorenceItaly - 25x Attractions & Sightseeing,"Dec 20, 2024· Firenze has more to offer than just the famous landmarks and highlights such as the Ponte Vecchio, the Florence Duomo and the Palazzo Vecchio. During your stay in Florence, make sure to visit these top 25 of most beautiful Florence tourist attractions and landmarks to get a good impression of what this Renaissance city has to offer.",Florence
30 BestThings to do in Florencefor 2025 -The Tour Guy,"Mar 4, 2025· The Boboli Gardens, eat Lampredotto, see The Birth of Venus, rub a boar's nose, and more! Here are the top things to do in Florence, Italy!",Florence
Bestthings to do in Florence-Lonely Planet,"Feb 2, 2025· From incredible architecture to locally sourced dishes that will blow your mind, here are the top things to do in Florence.",Florence
18 FantasticThings to Do in Florence– Incl. Day Trips! - Miss …,"Sep 26, 2023· Ready to visit Florence and fall in love with one of the most beautiful cities in the world, to admire centuries-old art, and marvel at the architectural geniuses that managed to create such amazing buildings? Let’s embark on a trip and discover the best things to do in Florence, Italy, together!",Florence
19 Absolute BestThings to Do In Florence(+ Map) - Anywhere …,"Jan 27, 2022· The best things to do in Florence including the main must-see attractions and local experiences + travel tips where to stay, & map.",Florence
"The 15 BestThings to do in Florence, Italy - Wandering Wheatleys","May 8, 2023· With countless enigmatic art galleries, bustling piazzas, sprawling vineyards, and some of the most delicious food in the world, you’ll never want to go back home!",Florence
"THE 30 BESTThings to Do in Chennai(Madras), India (2025) -Tripadvisor","Kapaleeshwarar Temple, Marina Beach, Sacred & Religious Sites, Cultural Tours. For personalised recommendations, try our AI trip-planning product. See what other travellers like to do, based on ratings and number of bookings. Book these experiences for a close-up look at Chennai (Madras).",Chennai
"45 BestThings To Do In Chennai2024 (With Photos, Reviews)","With a plethora of beaches, art galleries, museums, monuments, parks and historic places, there is no dearth of things to do in Chennai. You (Read More) can paraglide, parasail, scuba dive, hike, trek, camp and try your hand at the most fun and outrageous adventure sports.",Chennai
90Places To Visit In Chennai- Holidify,"See most popular tourist places to visit in Chennai, top things to do, shopping and nightlife in Chennai, find entry timings, fees about various attractions in Chennai, Tamil Nadu",Chennai
Best Things To Do in Chennai| 13 Attractions and Activities,"The 13 best things to do in Chennai. Classic South Indian fare, fashion and hospitality take centre stage when tackling the best things to do in Chennai",Chennai
48Things to Do in Chennai2025: Upto 40% Off - Thrillophilia,"Revel around the Marina Beach, Take a walk through Thalankuppam Pier, Stroll around Elliot’s Beach, Enjoy Nature Photography at Ubbalamadugu Falls, Fun rides in MGM Dizee World, Visit Mahabalipuram, Heritage tour to Royapuram Fishing Harbour, Enjoy Water sports in Muttukadu and many more.",Chennai
Top 20things to do in Chennai(Updated Sep 2024),"Explore the top 20 attractions in chennai, india. Find highly-rated attractions, popular spots, and hidden gems. Plan your perfect trip with our curated list of must-visit places in chennai.",Chennai
"20Must-Visit Attractions in Chennai, India- Culture Trip","Jan 9, 2018· South India’s cultural capital and gateway city, Chennai, is frequently counted among the best cities to visit in the world for food and culture among other things. But what really stands out in terms of Chennai ‘s potential as a tourist destination is the sheer number of cultural, historical, architectural and other sites it is home to.",Chennai
30Things To Do In ChennaiFor A Rejuvenating Vacay In 2025!,"Oct 26, 2021· Here are things to do in Chennai that you must try on your next [year] trip to this South Indian beauty. From adventurous to calming there is so much to try.",Chennai
15 BestThings To Do In Chennai- Travel.Earth,"Apr 8, 2024· Chennai is famous for its pristine beaches, historic temples, alluring sunrise and sunset views, ancient structures, and numerous adventure activities. Visiting numerous places allows you to uncover the rich history, vibrant culture, and heritage of the land.",Chennai
THE 10 BESTThings to Do in Chennai (Madras) (2025) -Tripadvisor,"Book these experiences for a close-up look at Chennai (Madras). These rankings are informed by Tripadvisor data—we consider traveller reviews, ratings, number of page views, and user location. 1. Kapaleeshwarar Temple. Dravidian temple in Mylapore with rich ancient architecture and serene spiritual ambiance.",Chennai
20Things to Do in Beijing: Best Options You Should Not Miss,"Here we describe for you the top 20 things to do in Beijing, a wide variety of experiences to cherish forever, including something for everyone. 1. Admire the Majestic Great Wall. The …",Beijing
"26AWESOME Things to Do in Beijing, China(2025 Guide)","Feb 5, 2025· From exploring the Forbidden City to walking along the famous Great Wall of China, here is our list of the absolute best things to do in Beijing. Welcome to one of the most awe …",Beijing
THE 15 BESTThings to Do in Beijing(2025) -Tripadvisor,"Things to Do in Beijing, China: See Tripadvisor's 676,833 traveler reviews and photos of Beijing tourist attractions. Find what to do today, this weekend, or in April. We have reviews of the …",Beijing
20 bestthings to do in Beijingaccording to locals,"Feb 21, 2023· Here are the 20 best things to do in Beijing. 1. Witness the Great Wall at Mutianyu. Spread across 4,000 miles, the majestic Great Wall of China has fascinated people for …",Beijing
The bestthings to do in Beijing-Lonely Planet,"Feb 23, 2024· Here's our guide to the most memorable, unusual things to do in Beijing. 1. Get lost in Beijing's hutong alleyways.",Beijing
"20 BestThings to Do in Beijing, According to a Local","May 20, 2023· Whether you’re a history buff, art lover, or foodie — there’s no shortage of things to do in the captivating city of Beijing. Tips for first-timers? We have it, too. Stand on the stairs …",Beijing
45 Must-See Sights andThings to Do in Beijing: Ultimate Guide,"Nov 7, 2024· From must-see sights to unique things to do in Beijing, I’ve curated the best experiences for budget travelers, whether it’s your first time here or you’re aiming to get a …",Beijing
Top 10 Things to Do in Beijing- TravelChinaGuide,"Aug 29, 2024· For both first-timers and frequent visitors, what are the things you must to do in Beijing and where do you must go? Besides the Great Wall and Peking Duck, are there any …",Beijing
Top 25 Must-DoExperiences in China’s CapitalBeijingin 2025,"Dec 23, 2023· As a proud local tour guide in Beijing, I’m excited to share the top 25 things to do in our incredible city. Beijing is a treasure trove of history, culture, and unforgettable …",Beijing
34 BestThings to Do in Beijingin 2025,"Jun 16, 2023· Must-visit attractions in Beijing include iconic landmarks such as Summer Palace, the majestic Forbidden City, and the awe-inspiring Great Wall. Moreover, Beijing offers a …",Beijing
THE 15 BESTThings to Do in Guangzhou(2025) -Tripadvisor,"Things to Do in Guangzhou, China: See Tripadvisor's 198,514 traveler reviews and photos of Guangzhou tourist attractions. Find what to do today, this weekend, or in April. We have reviews of the best places to see in Guangzhou. Visit top-rated & must-see attractions.",Guangzhou
The Top 12Things to Do in Guangzhou-China Highlights,"On your visit, you can find an interesting range of things to do, from some of the cheapest bargain shopping to some of China's best amusement and entertainment and skyscrapers and luxury malls. In some areas, the history has been well retained, notably on Shamian Island. 1. Visit Chimelong Safari Resort.",Guangzhou
Top 15Things to Do in Guangzhou2025/2026 - China Discovery,"Mar 26, 2018· Check the top 15 things to do in Guangzhou, including watching from Canton Tower, visiting Chen Clan Academy Hall, shopping at Beijing Road, etc. to plan your Guangzhou Tour in 2025/2026.",Guangzhou
"Top 10things to do in Guangzhou, China -Lonely Planet","Aug 8, 2018· Top 10 things to do in Guangzhou, China's third largest city, a metropolis full of cutting-edge architecture, tasty Cantonese food and colonial heritage.",Guangzhou
Top 25 BestThings to do in Guangzhou- Roaming China,"Sep 24, 2023· In this blog, we’ll take you on a virtual tour of some of Guangzhou’s most captivating destinations, each offering a unique glimpse into the city’s past and present. From historic temples to modern amusement parks, there’s something for everyone in Guangzhou.",Guangzhou
Top 20things to do in Guangzhou(Updated Jan 2025),"Discover the best-rated places to visit, eat, and stay in guangzhou. Our curated list includes top attractions, restaurants, and hotels. 1. Canton Tower Wharf offers stunning views of the city skyline and is a great starting point for river cruises along the Pearl River. 2. Chen Clan Ancestral Hall.",Guangzhou
