Title,Description,City
Top 45Thingsto Visit andDo in Guangzhou– Must-Visit Attractions,"Nov 6, 2024· Whether you’re a solo wanderer or just looking for things to do in Guangzhou, I’m here to share practical tips and tricks for experiencing the city’s top things to see and visit — all on a budget! In this post, we’re diving into 45 of the best things to see and do in Guangzhou.",Guangzhou
"THE 30 BESTThings to Do in Guangzhou, China (2025)","Book these experiences for a close-up look at Guangzhou. From quick jaunts to full-day outings. These rankings are informed by Tripadvisor data—we consider traveller reviews, ratings, number of page views, and user location. 1. Canton Tower. Iconic landmark tower featuring unobstructed city views, especially enchanting at night.",Guangzhou
Top 10 Things to Do in Guangzhou- TravelChinaGuide,"Dec 23, 2024· Cruising on Pearl River undoubtedly is one of the best things to do in Guangzhou at night. Cruising along the river let you get a whole new take on the city. You can enjoy the Haizhu Square, the famous Canton Tower, as well as various towering skyscrapers.",Guangzhou
Top 20Things To Do In Guangzhou: The Best Holidays In China,"Feb 7, 2025· Discover the best things to do in Guangzhou and travel around China with fun. Find fantastic attractions, temples, museums, centers, parks, rivers, towers, and streets. All must-visited places in one complete guide.",Guangzhou
25 BestThings to Do in Hamburg(Germany) - The Crazy Tourist,"Jun 15, 2022· Hamburg still has the second busiest harbour in Europe, and stands as a City-State in Germany’s Federal Republic. A constant ebb and flow of seafarers has given …",Hamburg
"13 BrilliantThings To Do in Hamburg, Written By A Local Expert","From markets to lakes and plenty of beer, here are my favourite things to do in Hamburg. RECOMMENDED: 🍲 The best restaurants in Hamburg 🏨 The best hotels in Hamburg",Hamburg
Things to Do in Hamburg,"Things to Do in Hamburg, Germany: See Tripadvisor's 506,889 traveler reviews and photos of Hamburg tourist attractions. Find what to do today, this weekend, or in April. We have reviews …",Hamburg
36 BestThings To Do In Hamburg(Best Attractions) - Germany …,"From iconic landmarks to hidden gems, we've got you covered with a no-nonsense list of the top experiences in Hamburg. Step into Miniatur Wunderland and gaze upon the intricate details of …",Hamburg
The topthings to do in Hamburg- Lonely Planet,"Feb 25, 2025· Explore the best things to do in Hamburg. See the stunning Elbphilharmonie, enjoy iconic nightlife along Reeperbahn, and wander the historic Old Town.",Hamburg
"18 Best Things to Do in Hamburg, Germany | U.S. News Travel","Feb 11, 2021· Hamburg is a walkable city with several attractions in one central location. Discover the best castles, museums and other things to do in Hamburg, Germany.",Hamburg
Visitors– The BestThings to Do in Hamburg,"Discover the best of Hamburg: Visit Landungsbrücken, St. Michael's Church, the Kunsthalle art museum and dance the night away on the Reeperbahn. Hamburg has a number of transport …",Hamburg
"23 BestThings to do in Hamburg, Germany (+Map) -Touropia","Jan 18, 2025· The second-largest city in Germany, Hamburg has long been home to one of Europe’s busiest ports. Aside from discovering its rich maritime history, there are plenty of …",Hamburg
33Things to Do in Hamburg: Top Attractions and Hidden Gems,"Feb 12, 2025· From unique museums to late-night activities, there are many great things to do in Hamburg. This guide will help you plan your perfect visit!",Hamburg
"The 15 BestThings to do in Hamburg, Germany - Wandering …","Feb 19, 2023· Don’t forget to check out our web story: The 15 Best Things to do in Hamburg, Germany. 1. Take a Walking Tour of Hamburg-Altstadt. 2. Explore HafenCity and …",Hamburg
15 BestThings to Do in Bordeaux (France) -The Crazy Tourist,"Apr 29, 2023· Lets explore the best things to do in Bordeaux: 1. Place de la Bourse. Bordeaux broke free of its old town walls when this majestic square on the left bank of the Garonne was …",Bordeaux
50 bestthings to do in Bordeaux,"As a passionate Bordeaux enthusiast, I’ve explored every corner of this vibrant city, from the top tours to hidden gems in charming neighborhoods, bustling markets, and cozy coffee spots. …",Bordeaux
Things to Do in Bordeaux,"Things to Do in Bordeaux, France: See Tripadvisor's 495,280 traveler reviews and photos of Bordeaux tourist attractions. Find what to do today, this weekend, or in April. We have reviews …",Bordeaux
25 Best & FunThings to Do in Bordeaux- The Tourist Checklist,"Bordeaux is a beautiful city in the southwest of France, famous for its wine, culture, and stunning architecture. Visitors can enjoy lovely parks, historic buildings, and delicious food. Whether …",Bordeaux
TopThings to do in BordeauxFrance: AFirst Timer's Guide,"Nov 6, 2023· Exquisite architecture, fresh seafood, a vibrant city with an historic core, and some of the best wine in the world—in a nutshell, this is Bordeaux, France. Even better, the whole …",Bordeaux
A Local’s Guide to the TopThings to Do in Bordeaux,"Oct 30, 2023· We’ve compiled all the best things to do in Bordeaux from the musts for fist-time visitors to the more off-the-beaten path that only locals know (and we’re always adding more). …",Bordeaux
7 bestthings to do in Bordeaux-Lonely Planet,"Jan 10, 2024· France’s sixth-largest city brims with museums, monuments and urban activities designed to thrust visitors hook, line and sinker into the heart of the action. Take time to learn …",Bordeaux
"BestThings to Do in Bordeaux, France | France Bucket List","This Bordeaux things-to-do list includes the best places to visit in Bordeaux, cultural attractions, and some of France’s most famous vineyards. How Many Days in Bordeaux? Although a day …",Bordeaux
The 14 BestThings to Do in Bordeaux: A Local’s Guide,"Aug 22, 2023· So if you’re thinking about taking a trip down by the Garonne River, there are plenty of things to do in Bordeaux for every kind of trip, and every kind of traveler, from …",Bordeaux
The 9 bestthings to do in Bordeaux- Time Out,"From vineyards to vinyls, these are the top nine things to do in Bordeaux. Planning your next trip? Check out our latest travel guides, written by local experts. 1. Visit an ultra-modern wine...",Bordeaux
THE 15 BESTThings to Do in Rio de Janeiro(2025) -Tripadvisor,"Things to Do in Rio de Janeiro, Brazil: See Tripadvisor's 1,425,598 traveler reviews and photos of Rio de Janeiro tourist attractions. Find what to do today, this weekend, or in April. We have reviews of the best places to see in Rio de Janeiro. Visit top-rated & must-see attractions.",Rio de Janeiro
"17Best Things to Do in Rio de Janeiro, Brazil | U.S. News Travel","Sep 29, 2023· Planning a trip to Rio? From relaxing on world-renowned beaches to visiting Christ the Redeemer, these are some of the best things to do in Rio de Janeiro, Brazil.",Rio de Janeiro
The 40 bestthings to do in Rio de Janeiro- Time Out,"Nov 14, 2024· From foodie hotspots to thrilling adventures, dive into the ultimate list of the best things to do in Rio de Janeiro. Recognized as a UNESCO World Heritage Cultural Landscape (the first...",Rio de Janeiro
30 BestThings To Do In Rio De Janeiro| Brazil Offbeat,"Jan 17, 2025· Check out this complete guide to Rio de Janeiro, with tips on the best time to visit, how to get there, where to stay, what to do, and much more! 1. Visit Christ the Redeemer. 2. Ride the Sugarloaf Cable Car. 3. Enjoy Copacabana, Ipanema, and Leblon Beaches. 4. Climb the Selarón Steps. 5. Explore Parque Lage. 6. Walk Through the Jardim Botânico. 7.",Rio de Janeiro
"33 AmazingThings to do in Rio de Janeiro, Brazil","Feb 28, 2025· Looking to experience the best Rio de Janeiro has to offer? This list has it all! I’m talking national parks, beaches, local festivals, and everything in between. I’ve even included my must-know tips you won’t find anywhere else. We’ve spent a lot of time in Rio as tourists and each time we go we find something new to fall in love with.",Rio de Janeiro
The 8 bestthings to do in Rio de Janeiro-Lonely Planet,"Feb 16, 2025· Planted between lush, forest-covered mountains and fabulous beaches, Rio is surely one of the world’s most beautiful cities. Verdant peaks and golden sands fronting a deep blue sea offer a range of adventures: surfing great breaks, hiking through Floresta da Tijuca’s rainforest and rock climbing up the face of Pão de Açúcar (Sugarloaf Mountain).",Rio de Janeiro
28 BestThings to Do in Rio De Janeiroin 2024 - The Planet D,"May 10, 2023· Are you looking for the best things to do in Rio de Janeiro? From Christ the Redeemer to Ipanema Beach, these are the top things to do in Rio De Janeiro.",Rio de Janeiro
15 BestThings to Do in Rio de Janeiro: SeeRio's Top Attractions,"Oct 31, 2024· There are so many things to do in Rio de Janeiro for tourists, whether visiting for the first time or coming back for more. From breathtaking viewpoints and pristine beaches to historic neighborhoods and modern museums, Rio offers an abundance of attractions for visitors to explore.",Rio de Janeiro
Things to do in Rio de Janeiro: Your ultimate 7-day itinerary,"Read on to discover what to do in Rio de Janeiro for first-time travelers. The best way to start your day is early. These iconic landmarks are best visited in the morning, avoiding the peak hours. Numerous guided tours offer a fantastic combo experience to both Christ the Redeemer and Sugarloaf Mountain.",Rio de Janeiro
5 Daysin Rio de Janeiro: A Complete Itinerary for First Time Visit,"4 days ago· Day 1: Iconic Landmarks. You can plan to do Day 1 of Rio 5-Day Itinerary by yourself or with an organized tour.. Start your first day in Rio by visiting all the classic attractions of this city.. It is going to be a long day. So, you can book this tour to plan it efficiently, without worrying about organizing the logistics and transportation.. Or, if you are up for it, you can also DIY as a …",Rio de Janeiro
13 Best Things to Do in Sao Paulo| U.S. News Travel,"Feb 11, 2021· Ranking of the top 13 things to do in Sao Paulo. Travelers favorites include #1 Parque do Ibirapuera (Ibirapuera Park), #2 Pinacoteca do Estado and more.",São Paulo
"Things to Do in Sao Paulo, Brazil -Sao PauloAttractions -Tripadvisor","Things to Do in Sao Paulo, Brazil: See Tripadvisor's 1,569,005 traveler reviews and photos of Sao Paulo tourist attractions. Find what to do today, this weekend, or in April. We have reviews of the best places to see in Sao Paulo. Visit top-rated & must-see attractions.",São Paulo
The 16 bestthings to do in São Paulo- Time Out,"Jan 21, 2024· Sure, the city's glamorous restaurats and bars are renowned but dig deeper to find underground parties in abandoned factories, alleyways inked with Brazil's best street art and lofty views over...",São Paulo
50 IncredibleThings to Do in São Paulo• I Heart Brazil,"Apr 13, 2021· After spending over two decades traveling around São Paulo, I can say I not only know every nook and cranny of the city, but I also discovered many unique things to do in São Paulo. And now they are yours to explore!",São Paulo
"35Things to Do in São Paulo, Brazil - By a Local","Nov 20, 2023· A local’s guide to 35 of the best things to see and do in São Paulo for both first-time and returning visitors. From architecture to dining and street art to live music, discover all there is to do!",São Paulo
"THE 30 BESTThings to Do in Sao Paulo, Brazil (2025) -Tripadvisor","Book these experiences for a close-up look at Sao Paulo. Historical Town Of Embu Das Artes – Art Galleries, Artisan Shops, Handicraft... These rankings are informed by Tripadvisor data—we consider traveller reviews, ratings, number of page views, and user location. 1. Parque Ibirapuera.",São Paulo
"16Cheap & FREE Things to do in São Paulo, Brazil","Oct 6, 2023· São Paulo, Brazil can really be a cheap and fun place to visit especially with this awesome list of the best things to do in São Paulo. Just remember to get out and see the city, mingle with the people, and enjoy that amazing Brazilian culture that’s famous around the world!",São Paulo
65 PopularThings To Do In São PauloRight Now - Spark Nomad,"Nov 15, 2023· Exploring its cultural heritage through landmarks like the São Paulo Cathedral and the São Paulo Museum of Art, along with indulging in its renowned culinary scene at vibrant markets and innovative restaurants, offers immersive experiences.",São Paulo
Explore Top 10Things to Do in São Paulo- tripjive.com,"Jan 14, 2025· In this guide, discover São Paulo’s lively atmosphere, stunning architecture, and cultural diversity. Whether you love history or food, São Paulo has something for you. Avenida Paulista becomes a walker’s paradise on Sundays, and Liberdade is bustling. It’s the biggest Japanese area outside Japan.",São Paulo
BestThings to Do in Sao Pauloin 2024 | Traveleira,"Oct 20, 2024· For anyone interested in exploring the heart of Brazil, this Things to Do in Sao Paulo guide will provide an in-depth look at the must-see attractions, culinary delights, and tips for making the most of your time in this incredible city.",São Paulo
24 Best Things to Do in Buenos Aires | U.S. News Travel,"Nov 2, 2023· Discover the best experiences and things to do in Buenos Aires, Argentina, from seeing Eva Perón's final resting place to attending a dinner and tango show.",Buenos Aires
12 Free Things to Do in Buenos Aires | U.S. News Travel,"Things to Do in Buenos Aires FAQs What are the best day trips from Buenos Aires? Colonia del Sacramento, Uruguay (40 miles away): Visit the oldest city in Uruguay (a UNESCO World …",Buenos Aires
Buenos Aires Travel Guide | U.S. News Travel,"Guide to the best hotels and things to do in Buenos Aires. Maps, travel tips and more.",Buenos Aires
Palermo Reviews | U.S. News Travel,Palermo is ranked #1 out of 24 things to do in Buenos Aires. See pictures and our review of Palermo.,Buenos Aires
Puerto Madero Reviews | U.S. News Travel,"Mar 20, 2017· Puerto Madero is ranked #15 out of 24 things to do in Buenos Aires. See pictures and our review of Puerto Madero.",Buenos Aires
Museum of Latin American Art of Buenos Aires (Museo de Arte ...,Museum of Latin American Art of Buenos Aires (Museo de Arte Latinoamericano de Buenos Aires) is ranked #10 out of 24 things to do in Buenos Aires.,Buenos Aires
Colón Theater (Teatro Colón) Reviews | U.S. News Travel,Colón Theater (Teatro Colón) is ranked #3 out of 24 things to do in Buenos Aires. See pictures and our review of Colón Theater (Teatro Colón).,Buenos Aires
The Argentine Experience Reviews | U.S. News Travel,The Argentine Experience is ranked #5 out of 24 things to do in Buenos Aires. See pictures and our review of The Argentine Experience.,Buenos Aires
Buenos Aires Dinner Shows Reviews | U.S. News Travel,Buenos Aires Dinner Shows is ranked #4 out of 24 things to do in Buenos Aires. See pictures and our review of Buenos Aires Dinner Shows.,Buenos Aires
Palacio Barolo Reviews | U.S. News Travel,Palacio Barolo is ranked #18 out of 24 things to do in Buenos Aires. See pictures and our review of Palacio Barolo.,Buenos Aires
The 50Best Things To Do in Cape Townright now! - Inside Guide,"Dec 20, 2024· From Table Mountain and the Cape of Good Hope to the V&A Waterfront and False Bay, Cape Town is brimming with things to do, see, taste and explore.",Cape Town
44Best Things To Do in Cape Town- Time Out,"Start with Time Out's updated and expanded list of the very best things to do in Cape Town! With the Atlantic Ocean on the doorstep and Table Mountain National Park as the ‘back garden’,...",Cape Town
THE 15 BESTThings to Do in Cape Town(2025) -Tripadvisor,"Things to Do in Cape Town, South Africa: See Tripadvisor's 868,902 traveler reviews and photos of Cape Town tourist attractions. Find what to do today, this weekend, or in April. We have …",Cape Town
25 BestThings to do in Cape Town- The Crazy Tourist,"May 12, 2023· My pick on the 25 best things to do in Cape Town are therefore as eclectic as they are memorable. Miss them at your peril. 1. Table Mountain is more than an impressive …",Cape Town
10 bestthings to do in Cape Town-Lonely Planet,"May 3, 2023· These are the top things to do in Cape Town. 1. Admire the view from atop Table Mountain. The nomadic Khoe-San people who once lived on the slopes of Cape Town’s …",Cape Town
"30 BestThings To Do In Cape Town, South Africa (2025 Guide)","Jan 2, 2025· From taking the cable car to the top of Table Mountain, to exploring Cape Town’s wine route, to touring Robben Island or the Cape Of Good Hope, here are the 30 best things to …",Cape Town
50+Things to Do in Cape Town: A Local's Guide - Wanderlust …,"Mar 17, 2023· Cape Town is a “choose your own adventure” type of place. Whether you’re a foodie, adrenaline junkie or sports nerd – there are possibilities for every kind of traveller! …",Cape Town
Cape Town Things To Do- The City's Best Attractions and …,"Here's our full guide to the very best things to do in Cape Town right now, from museums and galleries to hikes and safaris.",Cape Town
63 BestThings To Do In Cape Town- In Africa and Beyond,"Cape Town, also known as South Africa’s Mother City, is consistently listed amongst the best cities in the world. Here are 50 great things to do in Cape Town.",Cape Town
"The Ultimate Guide toThings to Do in Cape Town, South Africa","Discover the best things to do in Cape Town, South Africa! Explore our ultimate guide for an unforgettable experience.",Cape Town
THE 15 BESTThings to Do in Langkawi(2025) -Tripadvisor,"Things to Do in Langkawi, Malaysia: See Tripadvisor's 196,410 traveler reviews and photos of Langkawi tourist attractions. Find what to do today, this weekend, or in April. We have reviews of the best places to see in Langkawi. Visit top-rated & must-see attractions.",Langkawi
25 BestThings to Do in Langkawi (Malaysia) -The Crazy Tourist,"Jan 26, 2020· One of the delights of Langkawi is that it has many different attractions that will appeal to visitors, but you can also easily get away from the main tourist hubs and spend time sampling the local food and strolling in the traditional markets. Let’s explore the best things to do in Langkawi: 1. Visit Eagle Square.",Langkawi
9 BestThings To Do in Langkawi(3-Day Travel Guide) - Salt in …,"Feb 21, 2024· Dig deeper into Langkawi’s adventurous side by exploring glorious waterfalls, viewpoints, dense jungle, and lush mangroves – home to many species of wildlife. The archipelago is a must-visit on your Malaysia travel route. Here are 3 days filled with the best things to do in Langkawi!",Langkawi
24 IncredibleThings To Do In Langkawi: Complete Guide,"Dec 12, 2024· Have the ultimate Langkawi vacation with this list of the top things to do in Langkawi from the Langkawi Sky Bridge to island hopping to the best beaches.",Langkawi
"THE 30 BESTThings to Do in Langkawi, Malaysia (2025)","Panorama Langkawi SkyCab, Langkawi Sky Bridge, Nature and Wildlife Tours, Beaches. For personalised recommendations, try our AI trip-planning product. See what other travellers like to do, based on ratings and number of bookings. Book these experiences for a close-up look at Langkawi.",Langkawi
Top 10 MustDo in LangkawiExperiences,"Nov 15, 2024· To ease your planning woes, here is our list of the top ten must do in Langkawi experiences. 1. Water sports and snorkelling: A trip to Langkawi will be incomplete without enjoying some water sports in the blue Andaman Sea. Pantai Cenang and Pantai Tengah are the most popular beaches in Langkawi for water adventures. Here, visitors can enjoy ...",Langkawi
Bestthings to do in Langkawi2025 - Klook Travel,"Escape the city life and cruise along the waters of the Langkawi UNESCO Global Geopark, or discover the diverse wildlife in the park and even visit bats at their humble abode. You can even take a trip to the Crocodile Adventureland to see these ferocious beasts up close!",Langkawi
"20 BESTTHINGS TO DO IN LANGKAWI, MALAYSIA: A GUIDE","Jan 16, 2025· Most visitors head to Langkawi for the powdery white pristine sandy beaches, exploring the ancient rainforests and waterfalls, seeing the magnificent vistas and picture perfect viewpoints not to mention the UNESCO protected mangroves.",Langkawi
25things to do in Langkawi,"From heart-pounding escapades to blissful moments of tranquility, let us guide you through the top 25 must-do adventures that will weave unforgettable memories into your Langkawi sojourn. 1. Mangrove Tour",Langkawi
"15 BestThings to Do in Langkawi, Malaysia in 2025","Jan 27, 2025· To help you plan your holiday easily, we’ve narrowed down the best Langkawi Malaysia attractions for you to consider during your upcoming trip. Check out some of the best things to do and experience in Langkawi Malaysia 2025 below. 1. Langkawi Jetski & Watersports Tour.",Langkawi
"17 UnmissableThings to do in Tokyo, Japan - Salt in our Hair …","Mar 19, 2025· Discover the sprawling metropolis of Tokyo, the capital city of Japan — home to weird and wonderful sights, neon flashing lights, expansive gardens, tavern-filled alleys, and sensory food markets.",Tokyo
The 28Best Things to Do in Tokyo-Condé Nast Traveler,"Jan 13, 2025· Our top recommendations for the best things to do in Tokyo, Japan, with pictures and travel tips. Find fun things to do, best places to visit, unusual things to do, and more for couples,...",Tokyo
THE 15 BESTThings to Do in Tokyo(2025) -Tripadvisor,"Things to Do in Tokyo, Japan: See Tripadvisor's 1,673,889 traveler reviews and photos of Tokyo tourist attractions. Find what to do today, this weekend, or in April. We have reviews of the best places to see in Tokyo. Visit top-rated & must-see attractions.",Tokyo
TokyoCity Guide - Whatto do in Tokyo-japan-guide.com,"Today, Tokyo offers a seemingly unlimited choice of shopping, entertainment, culture and dining to its visitors. The city's history can be appreciated in districts such as Asakusa and in many excellent museums, historic temples and gardens.",Tokyo
14 of the bestthings to do in Tokyo-Lonely Planet,"Mar 25, 2024· To maximize the experience on your first trip to Tokyo, here are our favorite things to do. 1. Experience a traditional Japanese art form. One of Asia's most iconic cities, Tokyo only became the capital of Japan in 1868, when the country's rulers decided to abandon centuries of conservative tradition and embrace the outside world.",Tokyo
101 bestthings to do in Tokyo- Time Out,"Our ultimate checklist of the best things to do and see in Tokyo, from museums and art galleries to restaurants and bars",Tokyo
50Things to Do in Tokyoin 2025: The Ultimate Bucket List,"Jan 6, 2025· That’s why I’ve put together this ultimate bucket list of 50 things to do in Tokyo in 2025! From visiting world-famous landmarks like the Tokyo Tower and Sensoji Temple to sampling delicious local cuisine and exploring historic neighborhoods, there’s something for everyone in Japan’s capital city.",Tokyo
Top 20Things to Do in Tokyo- Trip To Japan,"Feb 5, 2025· Discover the top 20 things to do in Tokyo, from iconic sights like Shibuya Crossing and Tokyo Skytree to hidden gems, street food, and cultural experiences!",Tokyo
28 bestthings to do in Tokyo,"Feb 24, 2025· Here, the very best things to do in Tokyo. Check flights Plan your stay. This gallery has been updated with new information since its original publish date. PixHound. Kuramae. Once home to Edo-period rice granaries that drew wealthy merchants to its streets, Kuramae has evolved into Tokyo's newest creative hub. The riverside neighbourhood maintains its …",Tokyo
30 Must-DoExperiencesin Tokyo(Our Personal Favorites),"Feb 24, 2025· 3. Sensoji Temple. The Sensoji Temple (浅草寺) of Asakusa (浅草) is one of the most popular temples in Tokyo and the oldest dating back to 645 AD. The temple features a vibrant and colorful red-colored temple area that begins at Nakamise Street, where visitors can enjoy a variety of tasty Japanese street food.",Tokyo
25 Best Things to Do in Osaka (Japan) - The Crazy Tourist,"Nov 1, 2021· Here are the 25 best things to do in Osaka… 1. Visit Osaka-jo Source: Sean Pavone / shutterstock Osaka Castle. Osaka Castle dates from 1583 when it was first built …",Osaka
OsakaTravel Guide - Whatto do in OsakaCity -japan-guide.com,Popular theme park at Osaka's waterfront. Southern downtown of Osaka. One of Japan's most impressive aquariums. Popular summer festival with fireworks. Reconstruction of the large …,Osaka
Things to Do in Osaka,"Things to Do in Osaka, Japan: See Tripadvisor's 433,669 traveler reviews and photos of Osaka tourist attractions. Find what to do today, this weekend, or in April. We have reviews of the …",Osaka
"15 MemorableThings to do in Osaka, Japan - Salt in our Hair …","Mar 19, 2025· Enjoy all the top things to do in Osaka, where neon lights and avant-garde fashion meet zen temples and narrow lantern-lit alleyways.",Osaka
26 UNIQUEThings to Do in Osaka[in 2025] - The Broke …,"Jan 23, 2025· Osaka is the fantastic fusion between the busting capital of Tokyo and the ancient past of Kyoto. More laid-back, friendlier, and even more obsessed with food than Tokyo, there …",Osaka
11 BestThings To Do In OsakaRight Now - Time Out,"From Osaka Castle to flashy Dotonbori, here are the best things to do in Osaka right now. 💮 Is it insane to go to Japan for a week? Kirsty Bouwers is a staff writer for Time Out Tokyo....",Osaka
"50things to do in Osaka, Japan | UltimateOsakaTravel Guide!","In this article, we’re going to share some of the best things to do in Osaka, combining a mix of food adventures, popular attractions, and one-of-a-kind experiences you’ll only get in Japan.",Osaka
