Title,Description,City
15 BestThings To Do in Osaka- Japan Cheapo,"May 15, 2024· From foodie delights to historic castles, here are some of the best things to do in Osaka. Pro tip: If you’re interested in Japanese knives, Sakai in south Osaka is the place to …",Osaka
[Osaka] 20 BestThings to Do in Osaka: Complete Guide to Top ...,"Dec 27, 2024· From towering skyscrapers to historic temples, from world-class entertainment to traditional shopping streets, this guide explores the city’s most remarkable destinations, …",Osaka
39 Best & FunThings To Do In Osaka (Japan),"Jun 14, 2024· Osaka is considered to be a friendly and vibrant city. It boasts the largest shopping street in Japan, ancient temples, the tallest building in Japan, and several museums important …",Osaka
"KyotoBucket List:18 Amazing Things to Do in Kyoto, Japan","Mar 13, 2021· Visiting the shrines and temples, with their perfectly landscaped gardens and views over the city, top the list for most visitors to Kyoto. But there are also bamboo groves and small neighborhoods to explore, food markets and shopping streets to visit, and some very cool day trips that you can take. The list of things to do in Kyoto is long.",Kyoto
15 best things to do in Kyoto-Lonely Planet,"Mar 1, 2025· Plan a trip around the following must-see sights and quintessential experiences to make the most of your time in Kyoto. Wooden prayer tablets at Kinkaku-ji. Rintaro Kanemoto for Lonely Planet. 1. Visit Kinkaku-ji the most popular temple in Kyoto.",Kyoto
KyotoTravel Guide - Whatto do in KyotoCity -japan-guide.com,"Countless temples, shrines and other historically priceless structures survive in the city today. Former Kyoto residence of the shogun. Large, excellent museum about trains in Japan. Imperial palace with beautiful gardens. Fresh food market street in central Kyoto. The Imperial Family's residence until 1868. Narrow lane offering atmospheric dining.",Kyoto
Things to Do in Kyoto,"Things to Do in Kyoto, Japan: See Tripadvisor's 584,066 traveler reviews and photos of Kyoto tourist attractions. Find what to do today, this weekend, or in April. We have reviews of the best places to see in Kyoto. Visit top-rated & must-see attractions.",Kyoto
"31 UnforgettableThings to Do in Kyoto, Japan - Never Ending …","Sep 9, 2019· There are so many incredible things to do in Kyoto—you can visit golden temples and vermillion shrines, stroll through Zen rock gardens and swaying bamboo forests, slurp down bowls of ramen and participate in graceful tea ceremonies.",Kyoto
50 BestThings to Do in Kyoto: 2025 Must-See Activities,"There are many Kyoto things to do, such as visiting the top attractions like Fushimi Inari Shrine or the Kinkakuji Temple, or hands-on cultural experiences like a traditional tea ceremony or learning the art of Japanese calligraphy.",Kyoto
"14 UnmissableThings to do in Kyoto, Japan - Salt in our Hair …","Mar 19, 2025· Spend your days wandering among gold-leafed palaces, tranquil Japanese Gardens, and ancient bamboo groves, or immerse yourself in the creative culture at trendy art spaces, vintage shops, and kimono rental stores. There are so many incredible things to do in Kyoto — discover them all in this complete travel guide!",Kyoto
Kyoto: 20 Main Attractions and Non-TouristyThings to Do,"Mar 17, 2025· Things to Do in Kyoto with Family 16. Kyoto Railway Museum. The Kyoto Railway Museum is situated just one station west of Kyoto Station. This facility is dedicated to trains and showcases exhibits that highlight the history of Japanese railways. Visitors can explore some of the displayed trains from the inside. Additionally, there is an interactive area featuring a train …",Kyoto
"The 18 BESTThings to Do in Kyoto, Japan (2025 Update) -NOMADasaurus","Jan 25, 2025· When trying to pick the best things to do in Kyoto, Japan, you can’t go past this guide! Be amazed at what to do in Kyoto, the ancient capital city of the country! Kyoto is one of the most popular places to visit in Japan and proudly one of the most culturally diverse cities in the world.",Kyoto
25 BestThings to Do in Kyoto: Explore Bucket List Spots Like ...,"Jan 10, 2020· As the capital of Japan for over 1,000 years, Kyoto has a long history as a cultural powerhouse, and you can still experience the city's historical beauty and unique traditions today. In this article, we've compiled 25 of the best things to do in Kyoto.",Kyoto
27 BestThings to Do in Mexico City|Condé Nast Traveler,"Dec 17, 2024· Our top recommendations for the best things to do in Mexico City, Mexico, with pictures and travel tips. Find fun things to do, best places to visit, unusual things to do, and …",Mexico City
THE 15 BESTThings to Do in Mexico City(2025) -Tripadvisor,"Things to Do in Mexico City, Mexico: See Tripadvisor's 825,823 traveler reviews and photos of Mexico City tourist attractions. Find what to do today, this weekend, or in April. We have …",Mexico City
The 24 bestthings to do in Mexico City- Time Out,"Sep 26, 2024· Our list of the best things to do in Mexico City has everything from awesome concerts to amazing attractions. Buckle up.",Mexico City
16Best Things to Do in Mexico City| U.S. News Travel,"Aug 4, 2023· Ranking of the top 16 things to do in Mexico City. Travelers favorites include #1 Museo Nacional de Antropología, #2 Bosque de Chapultepec and more.",Mexico City
The 20 BestThings to Do in Mexico City- Nomadic Matt's Travel …,"Mar 5, 2025· Here are what I think are best things to do in Mexico City so that you can have fun and really get to know the city and culture on your trip to this vibrant capital! 1. Take a Walking …",Mexico City
45 BestThings to Do in Mexico City| + Tips | 2025 - Voyage …,"Dec 3, 2024· Here is my guide to Mexico City with the 37 best places to visit and things to do, including activities for the whole family. You’ll find my best tips and advice to make the most of …",Mexico City
MexicoInsider’s 25 absolute bestthings to do in Mexico City,"Jan 15, 2025· There is nothing like Mexico City. It’s a city that caters to a range of interests. It is a treasure trove of historical sites, home to some of the finest museums in the world, and the …",Mexico City
49 IncredibleThings to Do in Mexico City- Maddy's Avenue,"Feb 1, 2025· Drawing on my experience living in Mexico City, this guide to the 49 best things to do in Mexico City includes it all: must-see Mexico City tourist attractions, unique, off-the …",Mexico City
The 17 BestThings to Do in Mexico City: Top Itineraries for First-tim,"Discover the Best Things to Do in Mexico City with this comprehensive guide. This city has something for everyone, whether you're a first-timer or a veteran traveler. From tasty tacos …",Mexico City
The bestthings to do in Mexico City- Time Out,"The ultimate guide to things to do in Mexico City, including events, festivals, attractions and free activites happening in the city.",Mexico City
