Title,Description,City
"15 IncredibleThings to do in Kandy, Sri Lanka's Culture ...","Dec 1, 2023· Looking for the ultimate guide on places to visit in Kandy?! From the very best things to do in Sri Lanka’s cultural capital, to where to stay, our top tips, and how to get around, we’ve got you covered.",Kandy
THE 15 BESTThings to Do in Kandy(2025) -Tripadvisor,"Things to Do in Kandy, Sri Lanka: See Tripadvisor's 150,681 traveler reviews and photos of Kandy tourist attractions. Find what to do today, this weekend, or in April. We have reviews of the best places to see in Kandy. Visit top-rated & must-see attractions.",Kandy
"18 BESTThings to do in Kandy, Sri Lanka (2025 Guide!)","Jan 3, 2025· We have put together the top 18 things to do in Kandy, but really, you can find so much more in this beautiful city! Don’t have time to read the full article? A few of our absolute favorite things to do in Kandy include: Admire the Royal Botanic Gardens, the largest botanical garden in the country!",Kandy
"9 GreatThings To Do in Kandy, Sri Lanka- Salt in our Hair ...","Feb 4, 2025· Things to do in Kandy. Apart from Sri Lanka’s stunning beaches, the country is also famous for its religious sites and spectacular train rides. This is where Kandy comes in on your Sri Lanka Route, as the gateway to one of the most epic train journeys in the world and host to a myriad of cultural exhibits.",Kandy
16 Amazingthings to do in Kandythat you'll absolutely love ...,"Jan 30, 2025· From exploring the sacred Temple of the Tooth to wandering the peaceful Royal Botanic Gardens, there are many incredible things to do in Kandy. The city’s vibrant streets, historic charm, and serene lake make it an unforgettable destination.",Kandy
"19 BESTThings to Do in Kandy2025 (Train, Temple, Markets)","Nov 15, 2024· In this guide, we cover all the amazing things to do in Kandy, Sri Lanka. We also have a guide on the best hostels in Kandy if you’re planning on staying overnight (which we recommend!). Before we traveled to Sri Lanka, some people (falsely) advised us to skip Kandy; and only take the train from here. And we are so glad we did not listen to them!",Kandy
13 BestThings To Do In KandyTo Bedazzle Your Sri Lankan ...,"Nov 17, 2021· Explore the city like a pro with this handy guide on best things to do in Kandy Sri Lanka! 1. Ashburnham Estate – A Cuppa Steaming Tea. 2. Pinnawala Elephant Orphanage – Elephant Ride. 3. Dambulla Cave Temple – Leisure Stroll. 4. Nilambe Buddhist Meditation Centre – Meditation. 5. Kandy Lake – Nature Walk. 6. Horton Plains National Park – Explore.",Kandy
"20 BESTThings to do in Colombo, Sri Lanka - Destinationless ...","Sep 9, 2024· There are the most beautiful temples, architectural wonders, and some of the best local Sri Lankan attractions hidden within this city. To make your planning easier, I have put …",Colombo
Things to Do in Colombo,"Things to Do in Colombo, Sri Lanka: See Tripadvisor's 272,875 traveler reviews and photos of Colombo tourist attractions. Find what to do today, this weekend, or in April. We have reviews …",Colombo
40 Seriously CoolThings to Do in Colombo- That’s What She Had,"Mar 7, 2025· The definitive guide to all the things to do in Colombo, Sri Lanka! From architecture gems, to historical places, to the best culinary expeirneces! Food and Travel Blog",Colombo
10+ IncredibleThings To Do In Colombo(+ Where To Eat) | The ...,"Aug 14, 2023· Discover the best things to do in Colombo, Sri Lanka with our comprehensive guide. From the historic Fort area to the bustling markets of Pettah, and the city’s stunning …",Colombo
"THE 30 BESTThings to Do in Colombo, Sri Lanka (2025)","Gangaramaya (Vihara) Buddhist Temple, Mount Lavinia Beach, City Tours, Multi-day Tours. For personalised recommendations, try our AI trip-planning product. See what other travellers like …",Colombo
One day in Colombo(Guide) – TopThings To Do,"Apr 29, 2024· These are the top sights and things to do during your one day in Colombo. Despite its new contemporary veneer, authentic street life is still easy to find. A good place to put at the …",Colombo
71Things to Do In Colombo- Holidify,"See most popular tourist places to visit in Colombo, top things to do, shopping and nightlife in Colombo, find entry timings, fees about various attractions in Colombo, Sri-Lanka",Colombo
"13+ IncredibleThings to Doin CharmingGalle Fort, Sri Lanka","Jun 1, 2024· Charming, exotic, and full of history: Galle is a must-see in Sri Lanka. Looking for the best places to visit in Galle Fort, Sri Lanka? Discover famous attractions, historic sites, …",Galle
Things to Do in Galle,"Things to Do in Galle, Sri Lanka: See Tripadvisor's 76,021 traveler reviews and photos of Galle tourist attractions. Find what to do today, this weekend, or in March. We have reviews of the …",Galle
33Places to visit in GalleSri-Lanka 2025 | Best Tourist places,"The top activities in Galle are Udawalawe National Park Safari Tour, Galle and Surrounding Areas Full Day Tour, Galle Private Car Charter, Whale Watching at Unawatuna Jungle Beach , …",Galle
25 Best & FunThings to Do in Galle- The Tourist Checklist,"From wandering through the old fort to visiting local markets, you will find plenty of exciting options. Get ready to make wonderful memories in this vibrant city! 1. Explore the Historic …",Galle
17 BestThings to Do in GalleSri Lanka 2024 | FootSteps.lk,"Aug 21, 2023· Step into the world of Galle, Sri Lanka, where history and beauty unite. Here, golden beaches meet amazing waves, and ancient stories echo through the air. Get ready to …",Galle
THE 30 BESTPlaces to Visit in Galle(2025) -Tripadvisor,"Check out must-see sights and activities: Galle Dutch Fort, Sea Turtle Farm Galle Mahamodara, Nature and Wildlife Tours, Historic Sites. For personalised recommendations, try our AI trip …",Galle
"12 BestPlaces to Visit in Galle,Things to Do& Sightseeing","Best tourist places to visit in Galle, Things to do in & around Galle, Sri Lanka - Explore top sightseeing attractions in Galle like Waterfalls, Lakes, Heritage & Pilgrimage sites along with …",Galle
13things to do in Galle Sri Lanka: Everything you needto know,"Mar 16, 2020· A complete guide to places to visit in Galle, Sri Lanka. Includes 13 amazing things to do in Galle from stilt fishing, bike tours, restaurants, and more.",Galle
"13 BestThings to Do in Galle, Sri Lanka: Everything You Need to …","Jan 1, 2024· Filling your days with cricket games, delicious eateries, and historical walls to walk around, you will have plenty to keep you busy on a visit to Galle. The fort town has become …",Galle
"16 AmazingThings to Do in GalleFort, Sri Lanka (2025)","Mar 8, 2025· Galle Fort is one of the most popular places to visit in Sri Lanka and it is easy to understand why – this is the country’s most charming town. On top of that, there are plenty of …",Galle
"21 FunThings to do in Nuwara Eliya, Sri Lanka","Mar 1, 2025· So here you have it, 21 things to do in Nuwara Eliya, Sri Lanka! 1. Explore Lake Gregory. The beautiful Lake Gregory! Lake Gregory is the large lake in the center of Nuwara Eliya, Sri Lanka. It is surrounded by beautifully manicured gardens and mountains – simply picture perfect! There are a few different ways you can explore Lake Gregory:",Nuwara Eliya
THE 15 BESTThings to Do in Nuwara Eliya(2025) -Tripadvisor,"Things to Do in Nuwara Eliya, Sri Lanka: See Tripadvisor's 80,122 traveler reviews and photos of Nuwara Eliya tourist attractions. Find what to do today, this weekend, or in March. We have reviews of the best places to see in Nuwara Eliya. Visit top-rated & must-see attractions.",Nuwara Eliya
12 EnthrallingThings To Do In Nuwara EliyaOn Your Vacation In …,"Dec 6, 2024· Here is the list of the best things to do in Nuwara Eliya. Take a quick look and choose what all activities are you going to indulge in on your vacation! 1. Pedro Tea Estate: The Tea Tasting Ritual. Tea is the elixir of life.",Nuwara Eliya
17 BestThings to Do in Nuwara Eliya(a Local’s Guide),"Sep 28, 2024· After years of travel, I would like to share my favorite things to do in Nuwara Eliya with you. Sri Lankan hill country is stunning. You’ll see gorgeous views of lush green mountains, waterfalls, and tiny houses scattered over the hills at every turn.",Nuwara Eliya
"Twodays in Nuwara Eliya, Sri Lanka - The bestthings to do","Jul 24, 2023· How to spend 2 days in Nuwara Eliya, Sri Lanka. Discover the best things to see and do, how to get there, where to stay and what to pack",Nuwara Eliya
15Things to Do in Nuwara Eliya- Holidify,There is no limit to what can one do in Nuwara Eliya! 1. Visit the Tea Plantations. Nuwara Eliya is known for its hills and tea estates sloping down on them. There are hundreds of acres of just tea plantations and estates all around Nuwara Eliya.,Nuwara Eliya
15 BestThings To Do In Nuwara Eliya (Sri Lanka),"From misty tea plantations and ancient temples to golden beaches and vibrant local markets, every detail is covered. Enjoy a fully customizable plan PLUS a pinned route map that reveals exactly where to go, what to see, and how to savor every moment.",Nuwara Eliya
"17 BestPlaces to Visit in Nuwara Eliya,Things to Do& Sightseeing","At a distance of 15 km from Nuwara Eliya Bus Stand, Mackwood Tea Factory is located at Labookellie near Nuwara Eliya in Sri Lanka. Also known as Labookellie Tea Factory, it is one of the finest tea centers in Sri Lanka and among the popular places to visit in Nuwara Eliya.",Nuwara Eliya
"Top 15 Must-Do Activities in Nuwara Eliya, Sri Lanka","Aug 30, 2023· Some must-do activities in Nuwara Eliya, Sri Lanka include visiting tea plantations, exploring Horton Plains National Park, taking a boat ride on Lake Gregory, and visiting the stunning Hakgala Botanical Gardens.",Nuwara Eliya
"TheTop Things to See and Do in Nuwara Eliya, Sri Lanka","Mar 17, 2021· Known as Little England, because some British settlers built their holiday bungalows here, Nuwara Eliya offers plenty to do, from hikes and jet ski rides for the adventurous, to markets, farm visits and colonial-era architecture for pleasure seekers – and everyone should visit the tea estates.",Nuwara Eliya
33 Best Places to Visitin Mumbai-MumbaiTourism,"From beaches to theme parks, from historical sites to religious spots, from shopping centres to wide array of eateries, Mumbai offers something for everyone. Mumbai Tourism is ideal for all …",Mumbai
11 BestThings to Do in MumbaiRight Now - Time Out,Wondering where to start in one of the most captivating cities in India? Start with the best things to do in Mumbai. They don’t call this place Maximum City without good reason. Mumbai is a...,Mumbai
THE 15 BESTThings to Do in Mumbai(2025) -Tripadvisor,"Things to Do in Mumbai, India: See Tripadvisor's 647,139 traveler reviews and photos of Mumbai tourist attractions. Find what to do today, this weekend, or in April. We have reviews of the …",Mumbai
50Things to Do in Mumbai- 2025 (Starting from ₹357 Only),"Dec 2, 2015· What to Do in Mumbai? Visit Gateway Of India, Elephanta Caves Tour, Visit Chhatrapati Shivaji Terminus, Day Out at Marine Drive, Visit Haji Ali Dargah, Explore Kanheri …",Mumbai
"42 BestThings To Do In Mumbai2024 (With Photos, Reviews)",There are a roster of fun activities and a plethora of things to do in Mumbai. From the very pretty Bandstand to the narro (Read More) w lanes of Andheri and the beautiful sunset at Haji Ali …,Mumbai
Places to Visit in Mumbai,"Book these experiences for a close-up look at Mumbai. These rankings are informed by Tripadvisor data—we consider traveller reviews, ratings, number of page views, and user …",Mumbai
50 Super AmazingThings To Do In MumbaiOn Your Vacay,"May 20, 2021· From ferry rides to wildlife, from checking out local delicacies to exploring historical forts and religious places, Mumbai has everything, for everyone. Be it a family vacation or a …",Mumbai
The topthings to do in Mumbai- Lonely Planet,"Feb 14, 2025· Discover the top things to do in Mumbai, from attending DIY theater productions to spotting art deco architecture and eating quintessential dishes.",Mumbai
Wantto dosomething fun? Indulge in these 7 interesting events …,"1 day ago· Nature: The sun is out and so are the porcelain crabs, coral stars, and octopuses on the shores of Mumbai. Head to this expert-led marine walk by Naturalists Explorers along the …",Mumbai
"15 BestThings To Do In Mumbai, India - Hand Luggage Only","Jan 15, 2025· Filled to the brim with incredible culture, historic buildings and the most amazing food, there is so many of the best things to do in Mumbai across the whole city. Obviously, if …",Mumbai
75 BestThings to Do in (New) Delhi(India) by a Local,"May 5, 2023· Let’s explore the best things to do in Delhi: 1. Gawking at the Qutab Minar. Qutab Minar is one of Delhi’s top attraction and a renowned UNESCO world heritage site. Standing 240 feet tall, this tower was established in the year 1192, by the very first ruler of Delhi – Qutb-ud-din Aibak. This minaret is named after its creator.",New Delhi
THE 30 BESTPlaces to Visit in New Delhi(2025) -Tripadvisor,"THE 30 BEST Things to Do in New Delhi, National Capital Territory of Delhi (2025) Places to Visit in New Delhi Check out must-see sights and activities: Qutub Minar , Swaminarayan Akshardham , Flea & Street Markets , Multi-day Tours .",New Delhi
10 of the bestthings to doinDelhi-Lonely Planet,"Jul 23, 2024· As one of the world’s oldest continually occupied cities, you don’t have to look far to encounter Delhi’s fascinating history. But there are also lots of under-the-radar experiences waiting for you in this diverse and captivating city. Get your Delhi explorations started with this list.",New Delhi
50Things to Do in Delhi- 2025 (Starting from ₹370 Only),"Feb 16, 2022· Explore Qutub Minar, Visit Lotus Temple, Explore Humayun's Tomb, Walk to India Gate, Visit Akshardham Temple, Go to Jama Masjid, Stroll in Connaught Place, Shopping in Chandni Chowk, Enjoy food at Paranthe wali Gali, Enjoy at Kunzum travel cafe, Visit Lodhi Garden, Explore Red Fort, Visit Dilli Haat, Explore Jantar Mantar, Shop at Sarojini Marke...",New Delhi
114Places To Visit In Delhi- Holidify,"India Gate looks stunning at night with the fountain displaying colourful lights. The surrounding lush green lawns are a popular picnic spot. The Amar Jawan Jyoti is also located here. 2. Red Fort. The Red Fort is a historical fort in the old Delhi area, on the banks of Yamuna.",New Delhi
"Things to Do in New Delhi, India -New DelhiAttractions -Tripadvisor","Things to Do in New Delhi, India: See Tripadvisor's 1,049,515 traveler reviews and photos of New Delhi tourist attractions. Find what to do today, this weekend, or in April. We have reviews of the best places to see in New Delhi. Visit top-rated & must-see attractions.",New Delhi
12Best Things To Do in DelhiRight Now - Time Out,"The 12 best things to do in Delhi. The best things to do in Delhi involve delectable street food, fascinating museums, awesome markets and beautiful sites",New Delhi
THE 30 BEST Places to Visitin New Delhi(2025) - Tripadvisor,"Mar 17, 2025· Things to do near The Oberoi, New Delhi Things to do near Bloom Hotel - Karol Bagh Things to do near Crowne Plaza New Delhi Rohini, an IHG hotel Things to do near The Leela Palace New Delhi Things to do near The Imperial New Delhi Things to do near Crowne Plaza New Delhi Okhla an IHG Hotel Things to do near The Lodhi Things to do near Deventure ...",New Delhi
Top 20things to do in New delhi(Updated Sep 2024),"Explore the top 20 attractions in new delhi, india. Find highly-rated attractions, popular spots, and hidden gems. Plan your perfect trip with our curated list of must-visit places in new delhi.",New Delhi
"40 BestThings To Do In New Delhi2024 (With Photos, Reviews)","Delhi is a metro town bustling with activity, vibrant in all its glory and splendour. From heritage monuments, to pretty garden, elite clubs, and crowded markets, there is dearth of things to do in D (Read More) elhi. You can go on a heritage walk or browse the markets or relax in the parks.",New Delhi
"Top things to do in Sydney - Top attractions, events & more","Find out the best things to do in Sydney today with the official tourism site! Discover upcoming events, activities and sightseeing locations around Sydney.",Sydney
Top attractions in Sydney | Sydney.com,"Discover the top attractions in Sydney. Explore Sydney's many attractions, sightseeing spots & landmarks that you must not miss.",Sydney
Things to do in Sydney City | Sydney.com,"From taking a selfie with iconic landmarks like the Sydney Opera House and Harbour Bridge to enjoying world-class dining, taking a scenic ferry ride on the sparkling harbour, attending a musical and checking out an art exhibition, there are a plethora of fun things to do in Sydney City.",Sydney
Things to do in Sydney South,"Head south of the CBD to discover Sydney South. Visit pretty national parks, explore small coves with stunning beaches, enjoy a day trip to Cronulla and much more.",Sydney
Things to do in Bondi | Sydney.com,"The iconic beachside suburb of Bondi is synonymous with sun, surf and sand. Come for the famous Icebergs and Bondi to Coogee Coastal Walk, and linger longer for cafes, bars, shopping, markets and more.",Sydney
"Sydney Highlights - Half Day Private Tour | Sydney, Australia ...","The perfect introduction to your stay in Sydney covering all the must-see iconic sights. Starting underneath the Harbour Bridge in The Rocks, you will discover Sydney’s colourful convict past. Enjoy amazing photo opportunities at The Sydney Opera House and Mrs Macquarie’s Chair.",Sydney
"Darlinghurst – Things to do, where to eat & more | Sydney.com","Start the day in this colourful Inner Sydney suburb by enjoying brunch at a trendy cafe and browsing the boutiques along Oxford Street. Once the sun goes down, discover an eclectic bar scene, delicious restaurants, lively theatre and energetic dance floors.",Sydney
Top things to do in Manly with kids | Sydney.com,"Located near the ferry wharf, head to Manly Kayak Centre to hire kayaks and stand-up paddleboards to explore the northern waters of Sydney Harbour, one the most beautiful natural harbours in the world.",Sydney
"Whats on in Sydney in March | Sydney, Australia - Official Travel ...","Held at Sydney Road and Short Street Plaza every Sunday, at the Manly Fresh Produce Market you'll find some of the best…",Sydney
"Windsor, The Hawkesbury - Things to do, accommodation","Windsor is a portal to Sydney's past. Settled in 1791, it's the third-oldest place of British settlement on the Australian mainland, and brimming with colonial architecture. Discover the area's rich history on heritage walks and paddlewheeler river cruises, before enjoying its old-style pub, quaint wineries and local foodie trail.",Sydney
25 BestThings To Do In Melbourne(Australia) -The Crazy Tourist,"Nov 1, 2021· Melbourne is a hip, dynamic metropolis, with an exciting city centre, inner-city neighborhoods that are full of unique character, and lush green parks and mountain ranges …",Melbourne
Things to do- What's OnMelbourne,"Find out what to do in Melbourne with our guide to what's on, including the best events, attractions and things to do in the city.",Melbourne
Things to Do in Melbourne,"Things to Do in Melbourne, Australia: See Tripadvisor's 884,188 traveler reviews and photos of Melbourne tourist attractions. Find what to do today, this weekend, or in April. We have …",Melbourne
100things to do in Melbourneat least once in your life,"So here is our ultimate bucket list: 100 amazing things to do in Melbourne right now, plus attractions, great restaurants, bars, fun festivals and everything in between.",Melbourne
What's On - City ofMelbourne,"Find out what's on in Melbourne with all the latest events, restaurants, bars, shopping destinations and things to do. Brought to you by City of Melbourne.",Melbourne
"THE 30 BESTThings to Do in Melbourne, Australia (2025)","Book these experiences for a close-up look at Melbourne. From quick jaunts to full-day outings. These rankings are informed by Tripadvisor data—we consider traveller reviews, ratings, …",Melbourne
Attractions and sights - What's OnMelbourne,"Discover what locals love about Melbourne with a guided tour of the city and its attractions. Melbourne laneways are filled with street art, stencils, paste-ups and mixed media. Find out …",Melbourne
14 bestthings to do in Melbourne-Lonely Planet,"Sep 20, 2024· From high culture to local life, here are the best things to do in Melbourne. 1. Track down the best coffee in Melbourne. Italian immigrants first brought a passion for quality coffee …",Melbourne
50Things To Do In Melbourne| The World LovesMelbourne,Here is our 50 best things to do in Melbourne. 1. Federation Square is an artistic and creative hub of Melbourne not to be missed. It hosts over 2000 events a year! These include cultural …,Melbourne
"25 BestThings To Do in Melbourne, Australia | M is forMelbourne","Dec 16, 2024· Looking for things to do in Melbourne? Whether it’s your first time or you’ve visited the city dozens of times, I’ve got you covered. Ah, Melbourne. My beautiful hometown. Cool …",Melbourne
34Best Things to Doin NYC in 2025 | U.S. News Travel,"Mar 19, 2025· Looking for the best things to do in New York City? Plan your trip with these expert tips for iconic attractions, including the Statue of Liberty, Broadway and more.",New York
NYCBucket List: 50 Epic Things to Do in New York City,"Dec 5, 2021· 50 best things to do in New York City: Manhattan, Queens, Brooklyn, the Bronx, Staten Island. Best free things to do & things to do with kids.",New York
The 100best things to do in NYCfor locals and tourists - Time Out,"Mar 3, 2025· Craving the best things to do in New York City? Discover top places to eat and drink, must-see museums, cool attractions and more.",New York
THE 15 BESTThings to Do in New York(2025) -Tripadvisor,"Things to Do in New York, United States: See Tripadvisor's 6,928,891 traveler reviews and photos of New York tourist attractions. Find what to do today or anytime in April. We have reviews of the best places to see in New York. Visit top-rated & must-see attractions.",New York
35 BestThings to Do in New YorkCity (For First Time Visitors),"Jan 31, 2024· Looking for the BEST things to do in New York City? Look no further! This happy tourist covers everything you need to know.",New York
45 BestThings to Do in New YorkCity [with Tickets],"Feb 6, 2025· New York City is packed with iconic landmarks, cultural sites, and unforgettable neighborhoods. On this page, we have listed the 45 Best Things to Do in New York City to help you make the most of your visit, along with ticket recommendations and local insider tips.",New York
New York City Bucket List: 100IncredibleThings to Doin NYC,"Feb 2, 2025· Without any further ado, here’s our New York City Bucket List, which includes 100 things to do before you die! 1. Row a boat at The Loeb Boathouse. Let’s kick off this New York City Bucket List with something special, shall we? Warm, sunny days are not to be wasted indoors!",New York
Top 20things to do in New york(Updated Sep 2024),"Discover the best-rated places to visit, eat, and stay in new york. Our curated list includes top attractions, restaurants, and hotels. 1. Central Park. A vast green oasis in the heart of Manhattan, perfect for leisurely walks, picnics, and outdoor activities. 2. Times Square.",New York
Top 10Things to Do in New YorkCity - visitNYC,"New York City offers countless things to see and do, whether you’re a first-time visitor or a seasoned local. Here’s a list of the top 10 must-see attractions and experiences in NYC that showcase the best of the city’s iconic spots, culture, and atmosphere.",New York
87 Best Attractionsin New Yorkfor 2025 - Time Out,"May 20, 2024· Use our guide featuring the best New York attractions as a bucket list for discovering historical landmarks, gorgeous parks and legendary museums.",New York
THE 15 BESTThings to Do in Los Angeles(2025) -Tripadvisor,"Things to Do in Los Angeles, California: See Tripadvisor's 773,159 traveler reviews and photos of Los Angeles tourist attractions. Find what to do today, this weekend, or in April. We have reviews of the best places to see in Los Angeles.",Los Angeles
33Best Things to Doin LA | U.S. News Travel,"Mar 19, 2025· Los Angeles has an exhaustive array of fun things to do, from the family-friendly La Brea Tar Pits and the must-visit Natural History Museum to a behind-the-scenes studio tour at Universal...",Los Angeles
54 Unforgettable Once-In-A-LifetimeThings To Do In Los Angeles,"Feb 24, 2025· Whether you’re a true Angeleno, a transplant, or a tourist, this list of the best activities in L.A. will help you navigate the essentials and discover must-do experiences to add to your 2025 bucket list! 1. Take an iconic hike to the Hollywood sign. Image by Venti Views via Unsplash. Get up close to the iconic Hollywood Sign!",Los Angeles
The 52 bestthings to do in Los Angeles- Time Out,"Mar 6, 2025· The best things to do in Los Angeles that we’ve visited, including cool museums, stair hikes, must-try restaurants and hidden parks",Los Angeles
30 BestLos Angeles AttractionsThat You Should See in 2025,"Jan 16, 2025· If you’re a tourist looking out for things to do, you’ll have no problem finding vacation inspiration, from Hollywood tours to a day at one of the city’s best beaches. And...",Los Angeles
The 26Best Things to Do in Los Angeles-Condé Nast Traveler,"Jan 22, 2024· Our top recommendations for the best things to do in Los Angeles, with pictures and travel tips. Find fun things to do, best places to visit, unusual things to do, and more for couples,...",Los Angeles
